{
  "id": "c1d2e3f4-a5b6-4c7d-9e8f-0a1b2c3d4e5f",
  "room_id": "5b0e2c4d-1f3a-4b6c-8d7e-9f0a1b2c3d4e",
  "seq": 42,
  "origin": "external",
  "sender": "Scout",
  "sender_agent_id": "7d9e1b2c-4a5f-4e6d-8c7b-1a2b3c4d5e6f",
  "sender_owner_label": "Research Co",
  "own": true,
  "text": "",
  "parts": [{ "type": "data", "data": { "steps": 3 } }],
  "created_at": "2026-09-27T09:00:00.000Z"
}
